{
  "content_hashes": {
    "research/trackers/ge16-news-judge-batch-1.json": "9bdab5d5a8f47c7d58a73cfb69bb19ef945327e0f2c3cf378bdce646576ac772"
  },
  "created_at": "2026-09-29T00:00:00+00:00",
  "edition_id": "20260929T000000Z",
  "lineage": {
    "inputs": [
      {
        "disposition": "staged-tracker-output",
        "file": "research/trackers/ge16-news-judge-batch-1.json",
        "sha256": "9bdab5d5a8f47c7d58a73cfb69bb19ef945327e0f2c3cf378bdce646576ac772"
      }
    ],
    "prior_edition": "20260928T145304Z",
    "run_id": "20260929T000000Z-0a1b2c3d"
  },
  "note": "P2.3 refresh promotion: run-staged tracker outputs copied into canonical; file paths are canonical-root-relative.",
  "row_counts": {
    "promoted_files": 1,
    "unchanged_files": 0
  },
  "schema": "ge16.edition.promotion.v1"
}
