{
  "content_hashes": {
    "research/trackers/ge16-news-candidates.json": "07fa484fbe03c2b28421ae664316029310f96102d9c43625fe304b9d823dc05a",
    "research/trackers/ge16-news-seen-pending.json": "60b51505f11c83ea759d21d656595c4debb587daea4aeb6dc53eca88bb1c9ecf"
  },
  "created_at": "2026-09-29T09:22:39+00:00",
  "edition_id": "20260929T092239Z",
  "lineage": {
    "inputs": [
      {
        "disposition": "staged-tracker-output",
        "file": "research/trackers/ge16-news-candidates.json",
        "sha256": "07fa484fbe03c2b28421ae664316029310f96102d9c43625fe304b9d823dc05a"
      },
      {
        "disposition": "staged-tracker-output",
        "file": "research/trackers/ge16-news-seen-pending.json",
        "sha256": "60b51505f11c83ea759d21d656595c4debb587daea4aeb6dc53eca88bb1c9ecf"
      }
    ],
    "prior_edition": "20260929T090159Z",
    "run_id": "20260929T092131Z-c1dcdd35"
  },
  "note": "P2.3 refresh promotion: run-staged tracker outputs copied into canonical; file paths are canonical-root-relative.",
  "row_counts": {
    "promoted_files": 2,
    "unchanged_files": 0
  },
  "schema": "ge16.edition.promotion.v1"
}
